{
  "slug": "electric-shop",
  "title": "Electric Shop",
  "type": "firemny-web",
  "description": "Moderná prezentačná stránka pre certifikovaného elektrikára z Košíc...",
  "image": "/img/portfolio/electric-shop/image.png",
  "url": "https://electricshop.esticode.sk",
  "demo": true,
  "published": true
}